{"artifacts":{"junit":"junit.xml","logs":["logs/unit-attempt-1.log","logs/integration-attempt-1.log","logs/play-mode-attempt-1.log","logs/build-smoke-attempt-1.log","logs/scene-manifest-attempt-1.log","logs/scene-manifest-attempt-2.log","logs/content-manifest-attempt-1.log","logs/content-manifest-attempt-2.log","logs/save-round-trip-attempt-1.log","logs/save-migration-attempt-1.log","logs/save-downgrade-rejection-attempt-1.log","logs/save-corruption-recovery-attempt-1.log","logs/save-crash-recovery-attempt-1.log","logs/packaged-narrative-attempt-1.log"],"report":"report.json","root":"."},"authorityReferences":{"capacityCriteriaTask":"t_7f6be100","releaseCriteriaTask":"t_4a5b066c","savePolicy":"unity/Docs/Schema1_Save_Migration_And_Recovery_Policy.md","sceneDecision":"DEC-SCENE-DELIVERY-002"},"contracts":[{"attemptCount":1,"attempts":[{"exitCode":0,"log":"logs/unit-attempt-1.log","logSha256":"54c4503d45b66eeb859987f0ec6deb6d0f8cfb235c05f78dc69c9e0ab43c4722"}],"evidence":{"contract":"unit","fixtureVersion":"qa-fixtures-v1"},"failureCode":"QA_UNIT","id":"unit","reasonCode":"contract_passed","status":"passed"},{"attemptCount":1,"attempts":[{"exitCode":0,"log":"logs/integration-attempt-1.log","logSha256":"00b3f137e3447a85ebce25e6109f84baca45db906e89e4b5593c972a6971d7e5"}],"evidence":{"contract":"integration","fixtureVersion":"qa-fixtures-v1"},"failureCode":"QA_INTEGRATION","id":"integration","reasonCode":"contract_passed","status":"passed"},{"attemptCount":1,"attempts":[{"exitCode":0,"log":"logs/play-mode-attempt-1.log","logSha256":"62486a468fe09476ae2098a6234f0390a4f779bd8815992146d3fd360a2593ef"}],"evidence":{"contract":"play-mode","fixtureVersion":"qa-fixtures-v1"},"failureCode":"QA_PLAY_MODE","id":"play-mode","reasonCode":"contract_passed","status":"passed"},{"attemptCount":1,"attempts":[{"exitCode":0,"log":"logs/build-smoke-attempt-1.log","logSha256":"9d5aca5daee92811e110a0863ef54ccd5d16f41859ed0dbfdf24850d28ee374f"}],"evidence":{"contract":"build-smoke","fixtureVersion":"qa-fixtures-v1"},"failureCode":"QA_BUILD_SMOKE","id":"build-smoke","reasonCode":"contract_passed","status":"passed"},{"attemptCount":2,"attempts":[{"exitCode":0,"log":"logs/scene-manifest-attempt-1.log","logSha256":"1f9990bc0eb14de51bb9ef1a2b1312ba9d03591be948cd35f3567de6cc8608bc"},{"exitCode":0,"log":"logs/scene-manifest-attempt-2.log","logSha256":"1f9990bc0eb14de51bb9ef1a2b1312ba9d03591be948cd35f3567de6cc8608bc"}],"evidence":{"contract":"scene-manifest","fixtureVersion":"qa-fixtures-v1"},"failureCode":"QA_SCENE_MANIFEST","id":"scene-manifest","reasonCode":"contract_passed","status":"passed"},{"attemptCount":2,"attempts":[{"exitCode":0,"log":"logs/content-manifest-attempt-1.log","logSha256":"a242922718f3670c35c5ae427fe42bf22359b9139151e02de62c04c49bfbc04c"},{"exitCode":0,"log":"logs/content-manifest-attempt-2.log","logSha256":"a242922718f3670c35c5ae427fe42bf22359b9139151e02de62c04c49bfbc04c"}],"evidence":{"contract":"content-manifest","fixtureVersion":"qa-fixtures-v1"},"failureCode":"QA_CONTENT_MANIFEST","id":"content-manifest","reasonCode":"contract_passed","status":"passed"},{"attemptCount":1,"attempts":[{"exitCode":0,"log":"logs/save-round-trip-attempt-1.log","logSha256":"7dfe5fad9b59978bbd15cefded23b897dae9671ee5833a2691a7f0f4f995cadc"}],"evidence":{"contract":"save-round-trip","fixtureVersion":"qa-fixtures-v1"},"failureCode":"QA_SAVE_ROUND_TRIP","id":"save-round-trip","reasonCode":"contract_passed","status":"passed"},{"attemptCount":1,"attempts":[{"exitCode":0,"log":"logs/save-migration-attempt-1.log","logSha256":"4278b45daee9a197c7d1ab46a57ec29720ab259cff3b4af0ffd2fe9beecb2d9d"}],"evidence":{"contract":"save-migration","fixtureVersion":"qa-fixtures-v1"},"failureCode":"QA_SAVE_MIGRATION","id":"save-migration","reasonCode":"contract_passed","status":"passed"},{"attemptCount":1,"attempts":[{"exitCode":0,"log":"logs/save-downgrade-rejection-attempt-1.log","logSha256":"c86ea1d43ed23eaaa9f2819b5545a283b8608676579246b7868a85b5f189766f"}],"evidence":{"contract":"save-downgrade-rejection","fixtureVersion":"qa-fixtures-v1"},"failureCode":"QA_SAVE_DOWNGRADE_REJECTION","id":"save-downgrade-rejection","reasonCode":"contract_passed","status":"passed"},{"attemptCount":1,"attempts":[{"exitCode":0,"log":"logs/save-corruption-recovery-attempt-1.log","logSha256":"454b43b94c76c68608cae98be373b05714d0100a93df647026e86b783ecb8790"}],"evidence":{"contract":"save-corruption-recovery","fixtureVersion":"qa-fixtures-v1"},"failureCode":"QA_SAVE_CORRUPTION_RECOVERY","id":"save-corruption-recovery","reasonCode":"contract_passed","status":"passed"},{"attemptCount":1,"attempts":[{"exitCode":0,"log":"logs/save-crash-recovery-attempt-1.log","logSha256":"7b16bd518dadfa7997aff73c6a69b1a0844f688181276c3cba4921e5ec4f7a61"}],"evidence":{"contract":"save-crash-recovery","fixtureVersion":"qa-fixtures-v1"},"failureCode":"QA_SAVE_CRASH_RECOVERY","id":"save-crash-recovery","reasonCode":"contract_passed","status":"passed"},{"attemptCount":1,"attempts":[{"exitCode":0,"log":"logs/packaged-narrative-attempt-1.log","logSha256":"9127827845294a433e0b82194ee943aec2b8e01b96ba96d7316e63a7c6f35647"}],"evidence":{"contract":"packaged-narrative","fixtureVersion":"qa-fixtures-v1"},"failureCode":"QA_PACKAGED_NARRATIVE","id":"packaged-narrative","reasonCode":"contract_passed","status":"passed"}],"environment":{"architecture":"AMD64","os":"Windows","pythonVersion":"3.11.16","unityExecutable":null,"variables":{"AL_QA_CLOCK_UTC":"2026-01-01T00:00:00Z","AL_QA_FIXTURE_VERSION":"qa-fixtures-v1","AL_QA_SEED":"1618033988","PYTHONHASHSEED":"1618033988","TZ":"UTC"}},"manualComparison":{"baselineId":"QA-MANUAL-2026-09-03-001","reasonCode":"automated_manual_equivalent","status":"passed"},"profile":"contract","provenance":{"build":{"artifactTreeSha256":null,"manifestSha256":null,"version":"1.0"},"content":{"narrativeCatalogSha256":"254e60de33a3d0e5ce9b686e2ed6f35d605d056bbd714bfbc92ff3a5809a064b","worldCatalogSha256":"32d310ef5710674a1173b3d540836bbd933216accc8c0b74e735caba1afecda8"},"save":{"fixtureManifestSha256":"d8dc9250eb1b8599abcd205e0f2515a8bd75ea9fceaa7c66bb6d1f0cce78a939","fixtureVersion":"qa-fixtures-v1","formatId":"anotherlife.local-save","schemaVersion":1},"scene":{"enabledManifestSha256":"010d43412345c434b5cf3f9999bd82103c286120231466e4063e701b8bcf3def","generatedManifestSha256":"d4ca2d31ff9e41d8d33662cb6cde00c2dc587f9f6d92bf83082dc252bbdbf37f"},"sourceDirty":true,"sourceRevision":"78dce10de8928f499a916b4a912fb712735f588e","suite":{"evidenceSchemaSha256":"27b1bf94e7897e49a620c3128d6f688ac51c4268bb4c6bc2d6e2906421eb9a63","manualBaselineSha256":"4ab99c71a43f33b06d0d19011d9a18c1e4a89cd4cea81cf5ae418fabbce268b8","policySha256":"52ecd268bb9843ac7092ed7a309dfb0e73561a435ebb7ef7a25fcc0286f6b006","runnerSha256":"48d73194d9cacd14672a205a9f8493efb990837fecf024407304fba45dd7361a"},"unity":{"revision":"1c726e1fb402","version":"6000.3.22f1"}},"reportSha256":"d2882907638502a1aa9eee5c36737fd98f4e50f15f25fea512936e99ae2e4e0f","run":{"clockUtc":"2026-01-01T00:00:00Z","fixtureVersion":"qa-fixtures-v1","id":"qa-55b5d1457d3dbd993fba","seed":1618033988},"schemaVersion":1,"status":"passed","stopShipPolicy":{"action":"return_nonzero_and_block_release_until_new_evidence_or_owner-approved_baseline","statuses":["material_divergence","flake","missing_evidence","nondeterministic_manifest","contract_failure"]},"suiteId":"anotherlife-deterministic-qa"}
